"Funding Program Name","Funding Type","Funding Amount/Range","Eligibility Criteria","Application Process","Application Deadline","Industry Focus","Funding Source","Geographical Restrictions","Website/Link to Apply","Contact Information","Required Documents","Duration of Funding/Support","Additional Benefits"
"IFB InnoFounder (Hamburg)","Grant (Stipend)","Up to €75,000 per startup (team of 3) – €2,500 per person/month (max 3 people, 18 months)&#8203;:contentReference[oaicite:82]{index=82}","Pre-seed startups in Hamburg (not yet founded or <1 year); innovative product/service in any sector (tech, media, etc.); must commit to base in Hamburg for grant period","Apply to IFB Innovationsstarter via online portal; submit pitch deck and project description; invited teams pitch to selection committee","Periodic calls (about 2–3 selections per year)","Media, tech, creative (priority to digital/content, but open to others)&#8203;:contentReference[oaicite:83]{index=83}","State (IFB Hamburg, co-funded by EFRE)","Hamburg","https://innovationsstarter.com/programs/innofounder/","IFB Innovationsstarter GmbH; info@innovationsstarter.com","Pitch deck, project description (template), team CVs","Up to 18 months (non-repayable stipend)&#8203;:contentReference[oaicite:84]{index=84}","Monthly founder stipend to cover living costs, allowing full-time focus; plus coaching from IFB, workshops, and networking in Hamburg startup scene&#8203;:contentReference[oaicite:85]{index=85}"
"IFB InnoRampUp (Hamburg)","Grant","Up to €150,000 grant (covers 90% of project expenses)&#8203;:contentReference[oaicite:86]{index=86}","Tech startups in Hamburg ≤2 years old; developing a novel product with clear market potential; must spend at least 10% of costs themselves","Apply to IFB Innovationsstarter (online form); need detailed project plan for product development/market launch; evaluated by committee","Several calls/year (approx quarterly)","Deep tech, innovative startups (focus on “DeepTech” in practice)","State (IFB Hamburg, EFRE co-funding)","Hamburg (startup ≤2 years, based in HH)","https://innovationsstarter.com/programs/innorampup/","IFB Innovationsstarter GmbH; info@innovationsstarter.com","Project plan, financial plan of expenses, pitch deck","Project duration typically 12 months (expenses reimbursed)","Non-dilutive funding for product development or pilot scaling; IFB reimburses incurred costs&#8203;:contentReference[oaicite:87]{index=87}; also access to IFB coaching and investor networks in Hamburg"
"Innovationsstarter Fonds Hamburg (InnoStarter)","Equity Investment","Typical investment €100k–€500k (seed round); up to ~€1M over multiple rounds","Early-stage startups in Hamburg (or willing to relocate); innovative technology or business model; co-investment with private lead investor required","Contact IFB Innovationsstarter fund managers with pitch; undergo due diligence; deal is co-invested alongside a lead VC/angel","No deadline (VC fund, invests year-round)","Tech, digital, life sciences (varied)","State (IFB Hamburg fund, public-private)","Primarily Hamburg (startup HQ in Hamburg)","https://www.ifbhh.de/innovationsstarter-fonds","IFB Innovationsstarter GmbH (Investment Team); info@innovationsstarter.com","Pitch deck, business plan, financials, IP info","N/A (equity investment)","IFB as a co-investor brings network and patience; no majority stake taken; can follow-on in later rounds; part of Hamburg’s startup ecosystem support"
"InnoVentures Fonds Hamburg","Equity Investment","€2–7 million per company (growth-stage fund)&#8203;:contentReference[oaicite:88]{index=88}","Later-stage startups/scale-ups in Hamburg that have completed seed stage; focus on life sciences, biotech, quantum, or other deep tech requiring larger capital","Connect via IFB or through referral after completing InnoRampUp/InnoStarter; formal VC due diligence and investment committee","No deadline (open fund)","Life sciences, biotech, deep tech (and others with high capital needs)&#8203;:contentReference[oaicite:89]{index=89}","State (IFB Hamburg large venture fund, launched 2023)","Hamburg","https://innovationsstarter.com/programs/innoventurefonds/","IFB Innovationsstarter – InnoVenture Fund team","Investor deck, financial model, product details","N/A (VC investment)","Large amounts of growth capital with co-investors; meant to fill Series A/B funding gap in region; leverages IFB network and government backing to attract private VCs"
"push! Startup Stipendium (Hessen)","Grant (Stipend)","Up to €40,000 total per startup (one-time grant)&#8203;:contentReference[oaicite:90]{index=90} – e.g. €2k/month for up to 12 months for team","Early-stage startups in Hesse; innovative idea; team must include or be supported by a Hessen university (often recent graduates)","Apply online via push.hessen.de during call; pitch deck and concept required; jury selects startups for funding","Periodic calls (e.g. once or twice per year)","All sectors (innovation and business potential required)","State (Hesse, HMWEVW, with ESF+ funds)","Hessen (must found/start in Hesse)","https://push.hessen.de/","StartHub Hessen (Hessen Agentur); push@hessen-agentur.de","Pitch deck, idea description, team profiles","12 months (grant usage period)","Non-dilutive grant gives runway to develop MVP&#8203;:contentReference[oaicite:91]{index=91}; includes coaching program (“Ideen Akzelerator”) with mentoring, workshops&#8203;:contentReference[oaicite:92]{index=92}; connects to Hessen startup network"
"Hessen Mikrodarlehen (Mikroliquidität)","Loan","€3,000 to €35,000 direct loan&#8203;:contentReference[oaicite:93]{index=93}; 7-year term; low interest ~2–3%; no collateral needed","Startups and small businesses in Hesse up to 5 years old; need small capital for launch or growth; have difficulty getting bank loans","Apply through WI Bank (Hessen); online form and interview; simpler process than bank loan","No deadline","All industries","State (WIBank Hessen)","Hessen","https://www.wibank.de/hessen-mikrodarlehen","WIBank Hessen; Tel +49 611 774-7333; kundenservice@wibank.de","Short business plan, financial needs statement, personal info","7-year loan (incl. 1 year no repayment)","No bank required (direct state loan); builds credit history; combined with coaching from regional partners if needed; relatively quick approval"
"Hessen Ideen Scholarship","Grant (Stipend)","€2,000/month per person (full-time) or €1,000 for part-time, for 6 months&#8203;:contentReference[oaicite:94]{index=94}","Graduate teams (max 3 people) from Hessen universities with innovative startup ideas; business not yet formed; degree ≤5 years ago","Apply via Hessen-Ideen.de; requires endorsement from applicant’s university; selection by state jury","Annual call (usually in autumn)","All sectors (often tech, social innovation from universities)","State (Hessen universities + state ministry)","Hessen","https://hessen-ideen.de/stipendium","Hessen Ideen Programm (Hessen Agentur Fulda)","Idea description, proof of degree, support letter from university incubator","6 months","Equity-free time to develop idea&#8203;:contentReference[oaicite:95]{index=95}; includes an “Ideen Akzelerator” program with mentoring and training&#8203;:contentReference[oaicite:96]{index=96}; networking among scholarship teams"
"InnoStartBonus (Sachsen)","Grant (Stipend)","€1,050 per month for 12 months (+€150/month per child)&#8203;:contentReference[oaicite:97]{index=97}","First-time founders in Saxony with innovative business idea; pre-company or very early-stage; must not have other main income (>20h job)","Apply to futureSAX during call (pitch deck + concept); shortlisted pitch to jury; ~10–15 startups per call get the stipend","Two calls per year (typically)","Open to all industries (innovation required)","State (Saxony, ESF funds)","Saxony","https://www.futuresax.de/innostartbonus","futureSAX GmbH (Saxon State Agency); innostartbonus@futuresax.de","Idea concept form, personal profiles, budget plan","12 months","Mentoring by futureSAX managers&#8203;:contentReference[oaicite:98]{index=98}; feedback from expert committee; networking with other founders; extension of €150/m for each child supports parent founders"
"MEP – Markteinführungsprogramm (Sachsen)","Grant","Startups <5 yrs: 75% of project costs up to €150,000; others: 50% up to €100,000&#8203;:contentReference[oaicite:99]{index=99}","Saxony-based SMEs launching an innovative product/service to market; emphasis on those <5 years old (get higher funding rate)","Apply to Sächsische Aufbaubank (SAB) with market launch project plan; documentation in German; SAB evaluates","Calls announced periodically (check SAB site)","Market launch of new products/processes (any industry)","State (Saxony, SAB)","Saxony","https://www.sab.sachsen.de (search 'MEP Zuschuss')","SAB Dresden; Tel +49 351 4910-4930","Project description (market entry strategy), budget, innovation proof","Project duration typically 1 year","Helps cover marketing, pilot deployment, certifications etc. for commercialization; non-repayable; encourages rapid scaling; especially generous (75%) for young startups&#8203;:contentReference[oaicite:100]{index=100}"
"Technologiegründerfonds Sachsen (TGFS)","Equity Investment","€200k–€600k initial equity; up to ~€3M total per company over multiple rounds","High-tech startups in Saxony (seed or early stage); scalable business in IT, medical, nano, etc.; strong team and tech; must locate in Saxony","Meet/pitch TGFS investment managers (submit deck via website or through referral); due diligence and negotiation for equity stake","No deadline (VC fund)","High-tech (ICT, medtech, machinery, etc.)","State/Regional VC (Saxony govt + banks)","Saxony (HQ or substantial operations in state)","http://www.tgfs.de/","TGFS (CFH Management GmbH); info@tgfs.de; Tel +49 371 237160","Pitch deck, business plan, financials, cap table","N/A (investment horizon ~5–8 years)","Funding plus active support: TGFS team offers connections to industry in Free State&#8203;:contentReference[oaicite:101]{index=101}; can coinvest with other VCs; local presence helps access Saxony research networks"
"ego.-START (Sachsen-Anhalt)","Grant (Stipend + coaching)","Gründerstipendium: €2,000/month per founder up to 18 months&#8203;:contentReference[oaicite:102]{index=102}; plus up to €5,400 coaching support","Innovative founders in Saxony-Anhalt before or shortly after business formation (<2 years); must create jobs or high-growth potential; typically with university link","Apply to Investitionsbank Sachsen-Anhalt (IB) with support of a regional “ego” startup initiative; include business concept and coach plan","Periodic calls (annually or as announced)","All industries (focus on innovative, knowledge-based)","State (Sachsen-Anhalt, ESF+)","Sachsen-Anhalt","https://www.ib-sachsen-anhalt.de/ego-start","Investitionsbank Sachsen-Anhalt, Gründerförderung; service@ib-lsa.de","Business concept, project plan, CVs, coaching plan","Up to 18 months stipend","Covers living costs so founders can focus full-time; includes funded coaching (max €5.4k)&#8203;:contentReference[oaicite:103]{index=103}; integrated into “ego.” startup support network with events and mentoring"
"IBG Risikokapitalfonds Sachsen-Anhalt","Equity Investment","Typical investment €200k–€1M seed; up to ~€5M over life of company","Startups in Saxony-Anhalt with growth potential; sectors vary (tech, industrial, etc.); usually require co-investor","Approach IBG (managed by bmp Ventures) with pitch; if initial interest, go through due diligence; coinvestment often with private lead","No deadline (fund invests anytime)","Various (ICT, life science, engineering, etc.)","State VC (Sachsen-Anhalt via IBG funds)","Sachsen-Anhalt","https://www.ibg-vc.de/","IBG / bmp Ventures AG; info@bmp.com","Pitch deck, business plan, financials","N/A (equity investment)","Local VC partner with long-term view; can leverage state networks (e.g. Fraunhofer in ST); typically patient capital but expects growth; board support and syndication with other investors"
"Thüringer Gründerprämie","Grant (Stipend)","Up to €3,500 per month for 12 months&#8203;:contentReference[oaicite:104]{index=104} (amount based on needs, typically ~€2,000–€3,000)","Innovative startup projects in Thuringia in pre-start or early stage; founders not employed full-time elsewhere; idea with significant innovation or IP","Calls by Thuringian Ministry via Aufbaubank; application includes concept and budget; evaluation by expert panel; ~10–15 awards per call","Semi-annual calls (usually)","Innovative/high-tech or high-growth startups","State (Thuringia, ESF+)","Thuringia","https://www.aufbaubank.de/Start-ups/Gruenderpraemie","Thüringer Aufbaubank; kundenservice@aufbaubank.de","Business concept, innovation description, budget plan, CVs","12 months","Pairs with coaching via ThEx (Thuringia startup hub); non-dilutive living support; intended to complement EXIST (it’s positioned as filling gaps for those who didn’t get federal grants)&#8203;:contentReference[oaicite:105]{index=105}"
"bm|t – Beteiligungsmanagement Thüringen funds","Equity Investment","Initial investments ~€200k–€1M; up to €4M total (varies by specific bm|t fund)","Startups based in Thuringia or willing to relocate there; innovative product and scalable model; various stages (seed to growth)","Pitch to bm|t (state VC); if fit with one of their funds (Seed Fund, Venture Capital Fund, etc.), undergo due diligence and negotiation","No deadline","All sectors (tech, industrial, healthcare, etc.)","State VC (Thuringia – bm|t is state-owned VC)","Thuringia","https://www.bm-t.de/","bm|t GmbH (Erfurt); info@bm-t.de; Tel +49 361 744710","Pitch materials, business plan, financials","N/A (investment)","Regional investor with multiple funds (including spezialized like “Seed Fund III”); brings local network and often co-invests with national VCs; portfolio support via board seats and management coaching"
"Gründerstipendium Mecklenburg-Vorpommern","Grant (Stipend)","€1,200/month per founder (full-time) for up to 18 months&#8203;:contentReference[oaicite:106]{index=106} (+€300 if PhD holder or child bonus)","Innovative startups in MV, just founded or about to found; founders must devote full time to project (no major side job); often linked to universities","Apply to GSA (Gründungswerft) or partner university in MV; submit concept, then pitch to a jury who awards stipends","Calls typically annually","Technology-oriented or knowledge-based startups","State (Mecklenburg-Vorpommern, ESF+ funded)","Mecklenburg-Vorpommern","https://www.gruenderstipendium-mv.de/","GSA – Gründerstipendium MV c/o HS Wismar; Marc Schröder, Tel +49 3841 753-7766&#8203;:contentReference[oaicite:107]{index=107}","Project description, proof of concept, mentor letter from university or incubator","Up to 18 months","Access to coaches via universities (e.g., Wismar’s RSI) during stipend&#8203;:contentReference[oaicite:108]{index=108}; networking among MV startups; stipend allows full focus without equity dilution"
"MV Start-up Förderdarlehen","Loan","Up to ~€20,000–€50,000 (exact product varies, e.g. Mikrodarlehen MV up to €20k)","Founders and small businesses in Mecklenburg-Vorpommern needing seed capital; often those not served by banks; business must be in MV","Apply via LFI/IB MV or partner network; provide business plan; simpler approval for small loans","No deadline","All sectors (with business plan)","State (Mecklenburg-Vorpommern)","Mecklenburg-Vorpommern","https://www.lfi-mv.de/ (Landesförderinstitut MV)","LFI Mecklenburg-Vorpommern, Schwerin; info@lfi-mv.de","Business plan, financial projections, personal data","Typically 5–6 year term","Enables financing for small startups; usually lower collateral requirements; can be combined with coaching by chambers or HWK; helps build credit and track record"
"Gründungsstipendium Schleswig-Holstein","Grant (Stipend)","€1,750/month for graduates, €800 for students, up to 12–18 months&#8203;:contentReference[oaicite:109]{index=109}","Students or recent graduates in SH with innovative, technology- or knowledge-based startup idea; not yet founded or very new startup; must devote full time (or study) to project","Apply through WTSH (business development agency); need support letter from a professor or startup center; juried selection","Calls typically 1–2 times per year","Tech, knowledge-based startups (especially university spin-outs)","State (Schleswig-Holstein, ESF funded)","Schleswig-Holstein","https://www.wtsh.de/foerderprogramme/gruendungsstipendium","WTSH GmbH Kiel; Tel +49 431 66666-849; fischbach@wtsh.de&#8203;:contentReference[oaicite:110]{index=110}","Idea description, proof of academic status, mentor letter, project plan","Up to 18 months","Additional training and coaching via WTSH and Startup Schleswig-Holstein network; stipend allows focus on developing prototype; integration with local incubators (e.g., Starterkitchen Kiel)"
"Seed- und Start-up Fonds II (Schleswig-Holstein)","Equity Investment","Investment tickets typically €0.1–0.5M (can go higher in follow-ons up to ~€3M)","Early-stage high-tech startups in Schleswig-Holstein; sectors include digital, life science, maritime, etc.; must be willing to have operations in SH","Contact MBG SH (fund manager) with pitch; if criteria met (innovative, scalable, located in SH), go through due diligence and investment committee","No deadline","Tech, knowledge-intensive startups","State (Schleswig-Holstein via MBG SH, co-investment fund)","Schleswig-Holstein","https://www.mbg-sh.de/seed-und-start-up-fonds","MBG Schleswig-Holstein; Tel +49 431 66084-0; info@mbg-sh.de","Pitch deck, business plan, financials, cap table","N/A (VC investment)","State-backed VC that often co-invests with private angels/VCs; provides equity without taking majority; connects startups to corporate network in SH; long-term support"
"Starthaus Coachingprogramm (BRUT) Bremen","Grant (Consulting + stipend)","Coaching package value ~€30k (training program) + €8,500 cash grant for living costs&#8203;:contentReference[oaicite:111]{index=111}","Prospective founders in Bremen/Bremerhaven with an innovative idea, prior to or just after company formation; must commit to intensive 12-month program","Apply to Starthaus Bremen; involves submitting idea and interviews; cohorts start 2x per year","Two intakes per year (usually)","All industries (focus on innovative business models)","State (Bremen, EFRE)","Bremen/Bremerhaven","https://www.starthaus-bremen.de/","Starthaus Bremen (BAB); info@starthaus-bremen.de; Tel +49 421 9600-372&#8203;:contentReference[oaicite:112]{index=112}","Application form, idea description, CVs","12 months program","Includes ~25 workshops and coaching sessions (lean startup, marketing, etc.)&#8203;:contentReference[oaicite:113]{index=113}; peer group networking; €8.5k grant to cover personal living expenses&#8203;:contentReference[oaicite:114]{index=114}; office space at Starthaus"
"BREMER MikroKredit","Loan","€5,000–€20,000 microloan; 5 years; low interest (~3–4%)","Startups and small businesses in State of Bremen needing small capital infusion; limited collateral or credit history","Apply via Starthaus/BAB; simple application with business idea; evaluated by Bremer Aufbau-Bank","No deadline","All sectors (especially small local businesses or solo startups)","State (Bremen, BAB)","Bremen","https://www.bab-bremen.de/","Bremer Aufbau-Bank (BAB); kundenservice@bab-bremen.de","Business idea summary, simple financial plan","5-year term (6–12 months grace)","Enables smallest ventures to get started; paired with advisory from Starthaus; no bank guarantor needed (BAB lends directly); helps in establishing credit record for future loans"
"Starter Stipendium Saar","Grant (Stipend)","Up to €3,000 per month for 12 months (for team of 2 founders, €1,500 each)&#8203;:contentReference[oaicite:115]{index=115}&#8203;:contentReference[oaicite:116]{index=116}","Innovative startups in Saarland up to 18 months after founding; founders must work full-time on project; any sector with convincing innovation","Apply to Saarland Economic Ministry via online portal (sigu.saarland); pitch deck and video; shortlisted pitch live to jury","Calls roughly once a year","All industries (priority to high-growth, innovative ideas)","State (Saarland Ministry of Economics)","Saarland","https://gruenden.saarland/starter-stipendium-saar/","Starterzentrum Saarland; Tel +49 681 501-1717; referat.b1@wirtschaft.saarland.de&#8203;:contentReference[oaicite:117]{index=117}","Pitch deck, idea description, optional video, financial outline","12 months","Intensive coaching and workshops alongside stipend (via partners like Dock11); free co-working space access; media exposure through Saarland marketing"
"Saarland Seed Capital (Saarländische Wagniskapital)","Equity Investment/Loan","Typically €100k–€300k seed investment (convertible or equity)","Early-stage startups in Saarland with growth potential; looking for first external funding; sector-agnostic","Contact SIKB or Saarland Economic Promotion corporation to present business; evaluation and matching with Saarland venture fund or angels","No formal deadline","All sectors (emphasis on innovative companies)","State (Saarland, via SIKB or Saarland Wagnisfonds)","Saarland","https://www.sikb.de/ (Saarländische Investitionskreditbank)","SIKB Saarland; startup funding desk; Tel +49 681 3830-0","Executive summary, financial plan, investor presentation","N/A (investment)","Local capital with understanding of region; often structured as convertible loan to ease process; connects startup with mentor network of Saarland Offensive für Gründung (SOG) if needed"
"Techstars Accelerator (Berlin)","Accelerator (Investment)","$120,000 investment (~€100k) for 6–10% equity&#8203;:contentReference[oaicite:118]{index=118}; plus perks (cloud credits, etc.)","Startups in any industry with strong team and traction or MVP; usually seed-stage; Techstars Berlin program especially interested in FinTech, Web3, Future of Work&#8203;:contentReference[oaicite:119]{index=119}","Online application on Techstars website; multi-stage interviews if shortlisted; cohort of ~10 companies","Programs 1–2 times per year (e.g. Techstars Berlin Spring and Fall)","Broad (with some thematic programs e.g. Techstars Berlin AI, etc.)","Private (Techstars, corporate partners)","International (Berlin location but startups worldwide can apply; must relocate for program)","https://www.techstars.com/accelerators/berlin","Techstars Berlin Program Director (listed on website)","Online application (responses about team, market, traction), video intro, pitch deck","13-week accelerator program","Intensive mentorship-driven program; access to Techstars mentor network; numerous investor demo days; lifelong alumni network; office space during program; equity mentorship for life"
"APX (Axel Springer Porsche)","Accelerator VC","Initial €50,000 for 5% equity&#8203;:contentReference[oaicite:120]{index=120}, with follow-on potential up to €500k","Pre-seed startups (often MVP stage) in any industry; preferably <3 years old; willing to incorporate in Germany if not already","Rolling application (APX reviews applications continuously); pitch and due diligence; investment offered each month to new startups","No set batch – invests year-round, cohort activities in cycles","Industry-agnostic (20+ industries)&#8203;:contentReference[oaicite:121]{index=121}","Private (Joint Venture Axel Springer & Porsche)","International (must establish a German presence)","https://apx.vc/","APX Berlin (Ohlauthallee); hello@apx.vc","Pitch deck via online form, product demo, cap table","100-day program (6-week accelerator sprints)","Hands-on venture development support&#8203;:contentReference[oaicite:122]{index=122}; office space in Berlin; large network of 250+ co-investors&#8203;:contentReference[oaicite:123]{index=123}; follow-on investment readiness support; strong media and corporate connections via Axel Springer and Porsche"
"Plug and Play Germany (Accelerators)","Accelerator (Equity-free, potential investment)","Often offers €25k–€50k pilot funding or optional investment; mostly program without direct cash (focus on corporate pilots)","Early and growth-stage startups in thematic programs (e.g. Fintech, Insurtech, Health, Supply Chain) that align with corporate partners’ interests; any location (must participate in Germany program events)","Apply online for specific vertical program (e.g. InsurTech Europe); reviewed by Plug&Play and corporate partners; ~20 startups per batch chosen","2 batches per year per vertical (typically)","FinTech, InsurTech, HealthTech, Mobility, Retail, etc. (vertical-specific)","Private (Plug and Play Tech Center + corporate sponsors)","International (programs run in Munich, Stuttgart, etc., open globally)","https://www.plugandplaytechcenter.com/germany/","Plug and Play Germany (Munich, Stuttgart etc.); info@pnptc.com","Online application, pitch deck, product demo","3-month program","No equity taken for program; access to corporate business development – intros to big corporate customers for pilots; workspace during program; optional seed investment from Plug&Play ventures in some cases; global network across Plug&Play locations"
