"Funding Program Name","Funding Type","Funding Amount/Range","Eligibility Criteria","Application Process","Application Deadline","Industry Focus","Funding Source","Geographical Restrictions","Website/Link to Apply","Contact Information","Required Documents","Duration of Funding/Support","Additional Benefits"
"hubraum (Deutsche Telekom Incubator)","Incubator/VC","Pre-seed funding typically €25k–€50k (convertible note) for equity option; or direct strategic investment for later-stage (amount varies)","Startups in tech domains strategic to Deutsche Telekom (5G, IoT, AI, AR/VR, cybersecurity, etc.); from early prototype to growth stage depending on program; international but focus on Europe/Israel/USA connectivity","Apply to specific hubraum programs or calls (e.g. 5G Prototyping); or send pitch to hubraum fund team; selection by Telekom experts if alignment","Occasional themed calls (e.g. Sustainability tech award)&#8203;:contentReference[oaicite:124]{index=124}; otherwise rolling for incubator","Telecommunications, connectivity, media, consumer apps (areas that benefit Telekom)","Corporate (Deutsche Telekom)","International (Berlin hub, but startups worldwide)","https://www.hubraum.com/","hubraum Berlin; contact@hubraum.com","Pitch deck, product demo, use-case for Telekom network","Programs 3–6 months (incubation), or ongoing support if investment","Telekom partnership opportunities: access to 80M Telekom customers if pilot succeeds; free telecom infrastructure (APIs, test 5G network); mentorship from tech and business experts at DT; office space in Berlin, Krakow or Bonn; follow-on investments via Telekom’s venture arm possible"
"Merck Accelerator (Darmstadt)","Accelerator (Grant/Investment)","Up to €50,000 equity-free funding&#8203;:contentReference[oaicite:125]{index=125}; possibility of pilot projects with Merck KGaA; no equity taken for program","Global early-stage startups in Healthcare, Life Science, Performance Materials, or related (e.g. bioinformatics, lab tech); typically with at least prototype; synergy with Merck’s areas","Apply online to Merck Accelerator; screening and interviews with Merck’s innovation team; ~10 startups selected per cohort (includes some from Merck Africa)","Annual cohorts (3-month program, usually start in Spring)","Healthcare, Life Science, Performance Materials (Chemicals)","Corporate (Merck KGaA)","International (must attend program in Darmstadt; relocation support provided)","https://accelerator.merckgroup.com/","Merck Innovation Center Darmstadt; accelerator@merckgroup.com","Online application form, pitch deck, video, detailed questions on technology","3-month program in Merck Innovation Center","Lab & office space at Merck HQ; mentoring by Merck experts; access to Merck research facilities; opportunities for Merck to become customer or partner; wrap-up demo day and ongoing alumni support"
"Bayer G4A (Grants4Apps) – Growth Track","Partnership / Investment","Up to €100,000 funding (often as convertible or pilot budget); varies by year (some tracks offer €50k grants)","Digital health and medtech startups with products that align to Bayer’s pharma or consumer health units; preference for startups with some traction (post-seed)","Apply to Bayer G4A call (usually annual with specific challenge areas); shortlisted pitch to Bayer; selected teams enter partnership program","Annual open call (themes like oncology, cardiology, women’s health, etc.)","Digital Health, MedTech, Life Sciences (focus on software/apps)","Corporate (Bayer AG)","International (program in Berlin, open globally)","https://www.g4a.health/","Bayer G4A Digital Health team; g4a@bayer.com","Application form, pitch deck, product demo, traction metrics","3–6 month partnership program","Co-working at Bayer’s Berlin space; direct access to Bayer business units and mentors; if pilot succeeds, potential long-term commercial contract with Bayer; no equity required for initial funding (Bayer may negotiate equity in separate deals if both agree)"
"ProSiebenSat.1 Accelerator","Accelerator (Investment + Media)","€25,000 cash for 5% equity&#8203;:contentReference[oaicite:126]{index=126}; plus up to €500,000 in TV advertising budget (media-for-equity deal option)","Early-stage consumer startups (B2C) with mass-market potential (so they can utilize TV reach); often web platforms, consumer products or services; startup should be German GmbH or willing to incorporate","Online application or referral; interview and pitch; 7–10 startups selected per batch","Twice a year (Spring and Fall batches)","Consumer products, e-commerce, digital media, marketplaces (anything benefiting from broad consumer marketing)","Corporate (ProSiebenSat.1 Media SE)","Primarily DACH region (to use German-language media reach)","https://accelerator.prosiebenSat1.com/","P7S1 Accelerator Team (Munich); accelerator@prosiebensat1.com","Application form, pitch deck, product demo","3-month program (Munich)","Intensive coaching (lean startup, KPIs, etc.); free office space in Munich; heavy media exposure – one startup gets a “Wildcard” for €3M ad budget on TV&#8203;:contentReference[oaicite:127]{index=127}; extensive mentor network (including successful P7S1 alumni entrepreneurs); demo day with investors; possibility to negotiate further media-for-equity deals post-program"
"SpinLab – The HHL Accelerator (Leipzig)","Accelerator (grant + services)","€6,000 grant (no equity) per startup&#8203;:contentReference[oaicite:128]{index=128}; perks worth >€15k (cloud credits, etc.); option for ~€100k convertible loan from SpinLab partners","Startups with a scalable model in e-health, smart city, energy, or related fields (not strictly limited); typically product prototype or early revenue; any location (must attend in Leipzig)","Apply via online form; about 10 startups per cohort; selection by SpinLab and corporate partners","Two cohorts per year (6-month each)","Smart Energy, eHealth, Smart City, InsurTech, etc. (quite broad)","Private (Sponsored by Stadtwerke Leipzig, VNG, Porsche, etc., and HHL)","International (Leipzig-based program, but global applicants welcome)","https://www.spinlab.co/apply","SpinLab Leipzig; application@spinlab.co","Online application, pitch deck, video pitch","6-month accelerator program","No equity taken; free office in creative Leipzig Baumwollspinnerei campus; €6k cash grant to cover living&#8203;:contentReference[oaicite:129]{index=129}; intensive coaching & workshops (strategy, sales, VC, etc.); access to investors and industry partners (e.g., energy utilities); alumni support and connections to Leipzig Graduate School (HHL) resources"
"Wayra Germany (Telefónica)","Accelerator/VC","~€50,000 initial investment (for ~7–10% equity) + potential Telefónica business opportunities; also up to €25k in services/credits","Startups in IoT, AI, telecom, or any domain that can partner with Telefónica (O2); seed stage (product launched or nearly there); open to global founders but must engage with Munich hub","Online application or pitch at Wayra events; selection by Wayra and Telefónica execs; ~5–10 startups a year (no fixed batch, more rolling)","Rolling (multiple startups onboarded throughout year)","Telecommunications, IoT, AI, cybersecurity, telecom customer solutions","Corporate (Telefónica Open Innovation)","International (Munich-based hub)","https://www.wayra.com/en/wayra-germany","Wayra Germany (Munich); de@wayra.com","Pitch deck, product demo, data on traction","6-month incubation (flexible)","Office space in Munich’s Wayra academy; access to Telefónica’s network and tech (APIs, data); mentoring from Telefónica execs; potential to become Telefónica’s supplier or to integrate product in O2 ecosystem; introduction to Telefónica’s global Wayra investor network"
"Antler Berlin","Accelerator (Venture Builder)","€110k for 10% equity (offered to teams formed, with €85k net after program fee)&#8203;:contentReference[oaicite:130]{index=130}","Individual founders or small teams in any industry, typically pre-company; strong domain expertise or tech skills; must attend full-time in Berlin program to form a startup","Apply as individual (or team) online; interview process to select ~60 individuals; program then forms teams and evaluates; investment committee decides which newly formed startups get funding at ~Week 12","Cohort 1–2 times per year in Berlin","All sectors (especially deep tech, SaaS, fintech, etc. Antler is industry-agnostic)","Private VC (Antler Global)","International (founders worldwide, need to relocate for program)","https://www.antler.co/berlin","Antler Berlin Program Team; berlin@antler.co","Application form, video, interviews (re places); once in program, need to develop pitch and business model for IC","~3 month program (venture generation)","€2,500/month stipend for first 2 months for accepted individuals (helps cover living); intense co-founder matching process; access to Antler’s global advisor network; post-investment: ongoing support and next-round investor intros; part of global Antler alumni network"
"Entrepreneur First (Berlin)","Accelerator (Venture Builder)","£80k (~€90k) investment for 10% equity&#8203;:contentReference[oaicite:131]{index=131} (provided after forming a company and passing EF’s Investment Committee)","Individuals (usually with deep tech or industry experience) who want to start a tech company and need a co-founder; must be able to work in Germany (visa support provided)","Apply as individual via EF site; multi-stage interview; ~50-100 individuals per Berlin cohort; 3 months to form teams and pitch; EF IC selects ~1/3 of teams to fund","Cohorts ~1–2 per year in Berlin","Deep tech, AI, B2B SaaS, and other high-growth areas (EF is agnostic but focuses on big, defensible ideas)","Private (EF fund backed by VCs and corporate)","International (must attend program in Berlin; many participants from EU & beyond)","https://www.joinef.com/location/berlin/","Entrepreneur First Berlin; info-berlin@joinef.com","Application form, interviews (no need business plan upfront since individuals apply pre-idea)","3-month team-building phase + 9-month support post-investment","Monthly stipend during program (~€2k) to cover living costs; intense co-founder matchmaking and ideation support; world-class mentorship from EF’s network; EF helps incorporate company; after investment, ~9 months of additional support to raise seed round; alumni network globally (EF in London, Singapore, etc.)"
"Next Commerce Accelerator (NCA)","Accelerator (Investment)","€50,000 for ~8% equity&#8203;:contentReference[oaicite:132]{index=132}; follow-on up to €150k possible; perks (services) worth ~€50k","Startups (pre-seed/seed) in commerce, e-commerce, logistics, retail tech or related; typically with MVP or early revenue; no regional restriction but should target European market","Online application on NCA.vc or via referral; screening and interviews; about 5–8 startups per batch","Batches roughly once a year (with 6-month runtime)","Commerce, Retail, E-Commerce, Logistics, Marketplaces","Private (NCA is backed by corporate partners and Hamburg funds)","International (program in Hamburg, open globally)","https://nca.vc/","Next Commerce Accelerator, Hamburg; info@nca.vc","Application form, pitch deck, product demo","6-month accelerator program","Tailored 1:1 mentoring, free co-working in Hamburg, access to 20+ corporate partners for pilots&#8203;:contentReference[oaicite:133]{index=133}; demo day with investors; continuing support via NCA alumni & investor network; connection to NCA corporate investor network for business contracts"
"TechFounders (Munich)","Accelerator (Pilot/Grant)","€25,000 equity-free project budget&#8203;:contentReference[oaicite:134]{index=134} for pilot; no equity taken","Early-stage startups ready to pilot their technology with corporate partners; focus on hardware, IoT, mobility, cleantech, robotics, industrial solutions; typically already have prototype","Apply online to TechFounders (run by UnternehmerTUM); selection with input from corporate partners seeking startup pilots; ~10 startups per batch","Batches twice a year","Industrial tech, Mobility, AI, IoT, Cleantech (varies by corporate partner interests)","Private (UnternehmerTUM, corporate-sponsored)","International (program in Munich; open worldwide)","https://techfounders.com/","TechFounders (UnternehmerTUM GmbH); info@techfounders.de","Online application, pitch deck, product details","20-week program","No equity or fees – startups keep IP; €25k grant for pilot costs&#8203;:contentReference[oaicite:135]{index=135}; deep collaboration with a matched corporate partner (BMW, Siemens, etc.) to test product; coaching and workshops via UnternehmerTUM; access to MakerSpace and prototyping resources; investor pitch day at end"
"ESA Business Incubation Centers (ESA BIC)","Incubator (Grant + support)","€50,000 equity-free funding&#8203;:contentReference[oaicite:136]{index=136} (typically €25k from ESA + €25k from regional co-fund) per startup; plus technical support worth ~€50k","Startups (<5 years) developing space-related applications or using space tech in non-space sectors, or developing innovative space tech; must be based in region of an ESA BIC (e.g. Bavaria, Northern Germany, Hessen)","Apply to regional ESA BIC (each has 1–2 calls per year); proposal and business plan required; selection by ESA BIC evaluation board","Calls 2–4 times/year depending on center","Space tech, satellite applications, navigation, Earth observation, aerospace materials","EU/ESA (European Space Agency + regional gov’t partners)","Specific regions in Germany (e.g. Bavaria, Hessen, Baden-Württemberg, Bremen – each with an ESA BIC)","https://esa-bic.de/ (ESA BIC Bavaria & North)","ESA BIC Bavaria (Anwendungszentrum GmbH Oberpfaffenhofen); contact@esa-bic.de","Business plan, technical feasibility, team CVs, incubation plan","Up to 24 months incubation","Free office/lab at incubator, technical mentorship from ESA and DLR experts, business coaching, access to ESA facilities, investor matchmaking, ESA brand credibility; no equity taken; networking with other space startups across Europe"
"DB Mindbox (Deutsche Bahn Startup Hub)","Accelerator (Pilot Grant)","€25,000 non-equity funding for pilot&#8203;:contentReference[oaicite:137]{index=137}; no equity taken","Startups with solutions in mobility, logistics, rail infrastructure, construction tech etc. that can solve Deutsche Bahn’s challenges; usually MVP or product ready to test","Apply to specific DB mindbox challenges (e.g. “Digital Rail” or “Smart Logistics”); ~8–10 startups per batch; selected teams run a pilot with DB business units over 3 months","Multiple themed programs yearly (e.g. 3-4 open calls per year with specific deadlines)","Mobility, Logistics, Rail Tech, Construction (varies by program)","Corporate (Deutsche Bahn)","International (program in Berlin; any startup that can work with DB in Germany)","https://www.dbmindbox.com/","DB mindbox Berlin; team@dbmindbox.com","Online application, pitch deck, description of use-case for DB","100-day accelerator (approx. 3 months)&#8203;:contentReference[oaicite:138]{index=138}","€25k grant for pilot (no equity)&#8203;:contentReference[oaicite:139]{index=139}; workspace in Berlin (DB mindbox at Jannowitzbrücke); mentoring from DB experts; if pilot succeeds, potential long-term supplier contract with Deutsche Bahn; access to railway operational data and facilities for testing; demo day with DB executives and investors"
"Science4Life Venture Cup","Competition (Business Plan)","1st prize €25,000&#8203;:contentReference[oaicite:140]{index=140}; total prize pool ~€60k; additional coaching prizes","Teams or startups in Life Sciences, Chemistry or Energy from all over Germany; from concept to early-stage; often university spin-offs","Three-phase competition: Submit idea (Phase 1), then business plan (Phase 2 & 3) by deadlines; feedback given after each phase; finalists pitch to jury in final event","Annual cycle: Phase 1 (Nov), Phase 2 (Feb), Phase 3 (May) with final awards in summer","Life Sciences, Chemistry, Energy (Science-based startups)","Private-Public (sponsored by Hess. Ministry of Economics and Sanofi)","Germany-wide (must be based in Germany)","https://www.science4life.de/","Science4Life e.V., Frankfurt; info@science4life.de","Idea abstract, then full business plan (incl. market, finance, etc.)","N/A (competition spans ~6–8 months)","Extensive feedback and coaching at each stage by experts; workshops on business plan writing; for finalists, mentoring to refine pitch; winners join Science4Life alumni network and often get media publicity; some in-kind services as additional prizes"
"KfW Award Gründen","Competition/Award","€1,000 for each state winner; €9,000 for national winner; €5k public choice&#8203;:contentReference[oaicite:141]{index=141}","Startups from all 16 German states, founded in last 5 years; evaluated on innovation, social responsibility, and job creation","Nomination/application via KfW portal by deadline; one winner per state chosen by jury; those 16 compete for national prize and a public online voting prize","Annual (application in spring, awards in fall)","All industries","Public (KfW Banking Group)","Germany-wide (one winner per Bundesland)","https://www.kfw.de/award-gruenden/","KfW Award Office (Neu-Isenburg); gruenderwettbewerb@kfw.de","Application form including business description, achievements, sustainability info","N/A (one-time award)","Prestigious recognition by KfW (Germany’s development bank); PR coverage and media package for winners; networking event at award ceremony with investors and other entrepreneurs; no strings attached to prize money"
"Deutscher Gründerpreis","Award (Competition)","No direct cash (prizes are coaching, media and networking support; separate Junior category for students)","Outstanding startups in Germany with scalable business and exceptional founders; typically companies a few years old showing growth; multiple categories: Startup, Newcomer, Lifetime Achievement etc.","Candidates are nominated by experts or regional chambers; a jury of business leaders selects finalists; final pitch/interview for Startup category","Annual (nominations in winter, awards in summer)","All industries (focus on exemplary entrepreneurship)","Private (Initiators: Stern, Sparkassen, ZDF, Porsche)","Germany-wide","https://www.deutscher-gruenderpreis.de/","Deutscher Gründerpreis Office (Hamburg); info@deutscher-gruenderpreis.de","Nomination dossier, company financials, interviews (if finalist)","N/A (award event)","High-profile mentorship: winners in Startup/Newcomer get Porsche consulting for 1 year, coaching by Sparkasse, media coverage in Stern magazine and ZDF; access to alumni network of Gründerpreis winners; significant publicity which often leads to investor interest"
"Green Alley Award","Competition (Award)","€25,000 cash for winner&#8203;:contentReference[oaicite:142]{index=142}; finalists get workshops and mentoring","European startups in Circular Economy: recycling, waste reduction, sustainable materials, digital circular solutions; early-stage to growth (need a prototype and ideally traction)","Apply online (pitch deck + questionnaire); 6 finalists across Europe are invited to pitch in Berlin; one winner selected by jury","Annual (applications by late Autumn, final in Spring)","Circular Economy (Green tech, Waste management, Recycling)","Private (Landbell Group and partners)","EU-wide (startup must be based in Europe)","https://green-alley-award.com/","Green Alley Award Team (Landbell AG); info@green-alley-award.com","Online application, pitch deck, optional video","N/A (one-off event)","Finalists receive one-on-one mentoring day before final (with experts in business modeling, EU law, etc.); networking with investors and industry at final event; post-competition publicity; former finalists often get into further accelerator programs or investment rounds"
"Social Impact Labs (Grants & Incubation)","Grant/Incubation","Stipends typically €5,000–€12,000 total per project (varies by program sponsor) plus 4–8 months free incubation","Social entrepreneurs and impact startups in Germany tackling societal challenges (e.g. inclusion, education, sustainability); early-stage (idea or prototype) often with underrepresented founders (e.g. migrants, people with disabilities)","Apply to specific Social Impact programs (e.g. “Sink or Swim” for refugee founders, etc.); selection by Social Impact Lab jury; if chosen, get place in lab and financial support","Several themed programs per year, depending on funding (check Social Impact website)","Social entrepreneurship (businesses with social or ecological mission)","Private/Philanthropy (e.g. JPMorgan Chase Foundation, KfW Stiftung fund these programs)","Germany (Labs in Berlin, Hamburg, Leipzig, Munich etc., often targeting local founders)","https://socialimpact.eu/en","Social Impact gGmbH (Potsdam); info@socialimpact.eu","Application form focusing on social problem & solution, impact, business idea, team background","Typically 6-month incubation program","Free co-working space at Social Impact Lab; intensive coaching & workshops (business model, impact measurement, etc.); mentoring by business experts; access to pro-bono legal/accounting; connection to donors and ethical investors; alumni network of social startups"
"Business Angels Netzwerk Deutschland (BAND)","Investor Network","No direct funding (network services); INVEST grant 20% for angels&#8203;:contentReference[oaicite:143]{index=143} available via BAND lobbying","Private individuals (angels) and startups seeking angel capital. BAND certifies angels for INVEST and fosters angel/startup matchmaking","Startups approach regional angel networks (many are BAND members) or attend BAND events (e.g. Business Angels Day); no centralized application – BAND provides platform for angels","Ongoing – BAND events and member networks have regular pitch meetings","All sectors","Private association (some public support for programs)","Germany-wide","https://www.business-angels.de/","BAND e.V. (Düsseldorf); info@business-angels.de","Startup must have pitch deck and executive summary to share with angels","N/A (networking events year-round)","BAND advocates for angel-friendly policies like INVEST&#8203;:contentReference[oaicite:144]{index=144}; startups get exposure via BAND’s regional member networks and competitions (e.g. Golden Aurora award for female angels/startups); no fees for startups; connections to over 50 regional angel clubs across Germany"
"coparion Co-Investment Fund","VC Fund","Invests €0.5M–€5M per round, up to €15M per company (always alongside a lead investor)&#8203;:contentReference[oaicite:145]{index=145}","High-growth startups in Germany in early-stage (Seed/Series A); any tech sector; must have an independent lead investor (VC or corporate) who invests at least equal amount","Lead investor submits proposal to coparion (via website or contacts); coparion conducts parallel due diligence; if approved, coparion matches the investment on same terms","No deadline (fund invests throughout year)","All innovative sectors (ICT, healthcare, deep tech, etc.)","Public-Private VC (Funded by BMWi and KfW Capital, €275M fund)","Germany (company must be German GmbH)","https://www.coparion.vc/","coparion, Cologne; contact@coparion.vc; Tel +49 221 988652-00","Lead investor term sheet, startup’s business plan, due diligence materials","N/A (investment, typical VC horizon 5–8 years)","Non-leading investor – coparion does not take board seats, lead sets terms; effectively doubles available capital for round; helps startups by validating round (government-backed fund credibility) and often more patient capital"
"Bayern Kapital (Seedfonds, Wachstumsfonds)","VC Fund","Typical initial ticket €250k–€1M for seed; up to €2–4M with follow-ons (varies by specific fund)","Startups based in Bavaria with innovative products; seed fund focuses on early-stage (product dev); also has growth fund for later stage; sectors include software, medical, industrial tech, etc.","Approach Bayern Kapital with pitch deck (online form or intro); they often co-invest with other VCs; investment committee decides case by case","No deadlines","All sectors (emphasis on high-tech and Mittelstand innovations)","State VC (Bavarian government via Bayern Kapital GmbH)","Bavaria","https://www.bayernkapital.de/en/","Bayern Kapital (Landshut); info@bayernkapital.de; Tel +49 871 92325-0","Pitch deck, business plan, financials, IP overview","N/A (equity investment)","Financing from state-backed VC dedicated to Bavarian companies; Bayern Kapital often helps syndicate rounds by attracting private co-investors; portfolio support and access to Bavarian industry networks; non-controlling stakes"
